{
  "schema_version": "1.0.0",
  "package_id": "content_story_001",
  "package_version": 1,
  "title": "月亮晚安故事",
  "category": "story",
  "age_tiers": [
    "age_3_4",
    "age_5_6"
  ],
  "asset_key": "content/story/moon-night-v1.bin",
  "sha256": "aaaaaaaaaaaaaaaaaaaaaaaaaaaaaaaaaaaaaaaaaaaaaaaaaaaaaaaaaaaaaaaa",
  "size_bytes": 786432,
  "status": "published",
  "submitted_at": "2026-10-01T08:00:00Z",
  "approved_at": "2026-10-01T09:00:00Z",
  "approved_by": "admin-001",
  "published_at": "2026-10-01T10:00:00Z",
  "catalog_revision": 12,
  "created_at": "2026-10-01T07:00:00Z",
  "updated_at": "2026-10-01T10:00:00Z"
}
